Author;Title;Place  /  Press;Year;Other editions  /  Translations;Source Type  /  voll.;Key Words;Synopsis;Archival / catalogue reference ;URL / Links;Notes
Pombo, Manuel de  [ 1769 - 1829 ];Resumen Histórico de la invasión y conquista de España por los Franceses. Comprehende desde el 2 de Mayo de 1808 de la Matanza de madrid, hasta 9 de Enero de 1812 en que fué tomada València. Por el Ciudadano Manuel de Pombo, Ministro Contador Superintendente de la Casa de Moneda de Santafé. En la Imprenta Patriótica de Don Nicolas Calvo.;Bogotá (Colombia);1812;;Printed text;Sacrifice for the Nation - Defense against foreign invasion - Spain - France - XIX cent. - Military history - Nationalism - Spanish Patriots - Sacrifice for Freedom - Sacrifice for Political Independence;"Racconta le vicende militari e le tragiche conseguenze economiche e politiche dell'invasione e conquista francese della penisola iberica, nella campagna napoleonica condotta tra il 1808 e il 1812. L'autore parla, in varie parti del testo, dell'immenso ""Sacrificio de la escuadra, y de la sangre y oro de la Nación""  (p. 69).";;http://bdh-rd.bne.es/viewer.vm?id=0000112061&page=1;
[ Anonymous ];"Versión parafrástica del Psalmo LXXVIII. Prece que nadie podrá leer este salmo sin considerarle como una profecía de las calamidades con que la divina justicia ha querido afligir à España por medio de la ferocidad de los franceses desde que la invadieron en 1808; y del fervor con que las almas buenas han implorado e imploran la misericordia del Señor [...]";Madrid, imprenta de Fuentenebro, calle Jacomotrezo;1813;;Printed text;Psalms - Sacrifice for the Nation - Defense against foreign invasion - Spain - France - XIX cent. - Sacrifice for Freedom;Traduzione del Salmo 78 in lingua spagnola, con commenti e note esplicative ai versi. Il traduttore e autore dei commenti al testo afferma che il detto salmo si possa leggere come una profezia delle calamità e disgrazie che il popolo spagnolo in quegli anni stava soffrendo a causa dell'invasione napoleonica (1808-1814), con uccisioni, saccheggi, incendi, stupri, violenze e atrocità perpetrate dagli invasori ai danni degli inermi suoi compatrioti.;;http://catalogo.bne.es/uhtbin/cgisirsi/x/0/0/57/5/3?searchdata1=3727399{CKEY}&searchfield1=GENERAL^SUBJECT^GENERAL^^&user_id=WEBSERVER;
[ Anonymous ];Estragos y ruinas, que la invasion de los exércitos franceses, ha causado en la península de España, en quanto á la verdadera Católica creencia, y rectitud de costumbres, que para su reparacion merece la atencion zelosa de los verdaderos Pastores Ministros del Santuario. Por un Párroco Extremeño del Priorato de San Márcos de Leon, en el Órden Militar de Santiago, Individuo del mismo Orden.;Madrid, imprenta de López García y hermano.;1814;;Printed text;Sacrifice for the Nation - Sacrifice for Faith - Defense against foreign invasion - Defense of Faith - Spain - France - XIX century - Spanish Patriots - Sacrifice for Freedom;"Il testo descrive ""le rovine, calamità e gli orrendi disastri"" che ha causato l'invasione francese in Spagna e le ""orribili sciagure e nefande atrocità"" che ha sofferto la Chiesa Cattolica in seguito all'invasione napoleonica in Spagna. L'autore, un anonimo parroco e religioso dell'Ordine di  Santiago in Estremadura, sottolinea in più punti il ""sacrificio di sangue"" di tanti soldati, ma anche di semplici fedeli suoi connazionali, la loro ""eroica resistenza"" di fronte all'invasione nemica e le infinite disgrazie sofferte dagli abitanti con la distruzione di intere città e l'orrore di territori devastati e il sacrificio di migliaia di uomini, caduti nella lotta per la difesa della fede e della Nazione.";;http://catalogo.bne.es/uhtbin/cgisirsi/x/0/0/57/5/3?searchdata1=6756307{CKEY}&searchfield1=GENERAL^SUBJECT^GENERAL^^&user_id=WEBSERVER;
Rivas, Juan de  ( † 1562 );Dialogum devotissimum de vita hominis Christiani.;;;;;;;Vedi: Nicholás Antonio, Bibliotheca Hispana Nueva, vol. I, p. 767;;
Rivas, Juan de  ( † 1562 );Vitas Patrum Sanctorum: Vitas Patrum, & suorum sociorum, qui primi lucem Evangelii his populis intulerunt.;;;;;;;Vedi: Nicholás Antonio, Bibliotheca Hispana Nueva, vol. I, p. 767;;
Collazo, Antonio;Relación de lo sucedido a los Padres de la Compañía de Jesús en la India Oriental, y Japón en los años de MDC y MDCI;Ex Lusitánico Ferdinando Guerrero, [ Pincia ? ];1604;;;;;;;
